{
  "bank_name": "HBL",
  "statement_id": "001-synthetic",
  "source": "synthetic",
  "privacy": "public",
  "currency": "PKR",
  "closing_balance": "12388.85",
  "period": { "start": "2024-01-02", "end": "2024-01-28" },
  "transactions": [
    {"transaction_date": "2024-01-02", "description": "Customer Payment ACME Corp", "debit": null, "credit": "2500.00", "balance": "12500.00"},
    {"transaction_date": "2024-01-05", "description": "Shell Pakistan Fuel Station", "debit": "85.40", "credit": null, "balance": "12414.60"},
    {"transaction_date": "2024-01-08", "description": "Office Rent January", "debit": "1200.00", "credit": null, "balance": "11214.60"},
    {"transaction_date": "2024-01-10", "description": "Salary Transfer Staff", "debit": "3500.00", "credit": null, "balance": "7714.60"},
    {"transaction_date": "2024-01-12", "description": "Marketing Facebook Ads", "debit": "220.00", "credit": null, "balance": "7494.60"},
    {"transaction_date": "2024-01-15", "description": "Utility Bill KESC", "debit": "145.75", "credit": null, "balance": "7348.85"},
    {"transaction_date": "2024-01-18", "description": "Sales Deposit POS", "debit": null, "credit": "980.00", "balance": "8328.85"},
    {"transaction_date": "2024-01-22", "description": "Purchase Inventory Supplier", "debit": "640.00", "credit": null, "balance": "7688.85"},
    {"transaction_date": "2024-01-25", "description": "Tax Payment FBR", "debit": "300.00", "credit": null, "balance": "7388.85"},
    {"transaction_date": "2024-01-28", "description": "Loan Disbursement", "debit": null, "credit": "5000.00", "balance": "12388.85"}
  ]
}
